<?xml version="1.0" encoding="UTF-8"?>
<!DOCTYPE BAM SYSTEM "bam.dtd">

<BAM>
  <modelName>Catalase Protection from Hydrogen Peroxide in a Biofilm</modelName>
  <modelDescr>Default BAM Model description ...</modelDescr>
  <rxnName>Growth</rxnName>
  <rxnName>Consumption w/ Live</rxnName>
  <rxnName>Consumption w/ Dead</rxnName>
  <rxnName>Disinfection</rxnName>
  <substrate name="Glucose" abbr="Glu" diff="+5.70000e-04">
    <rxnData stoich="-2" law="Monod" coeff="2.55"/>
    <rxnData stoich="0" law="ZeroOrder" coeff="1"/>
    <rxnData stoich="0" law="ZeroOrder" coeff="1"/>
    <rxnData stoich="0" law="ZeroOrder" coeff="1"/>
  </substrate>
  <substrate name="Hydrogen Peroxide" abbr="H2O2" diff="1.728E-4">
    <rxnData stoich="+0.00000e+00" law="ZeroOrder" coeff="+1.00000e+00"/>
    <rxnData stoich="-1" law="FirstOrder" coeff="5"/>
    <rxnData stoich="-1" law="FirstOrder" coeff="5"/>
    <rxnData stoich="0" law="FirstOrder" coeff="1"/>
    <biocide conc="1700" begin="2" duration="2" freq="4" det="0" pulseStep="Pulse"/>
  </substrate>
  <particulate name="Dead cells" abbr="Dead" rho="2.5e5">
    <rxnData stoich="+0.00000e+00" law="ZeroOrder" coeff="+1.00000e+00"/>
    <rxnData stoich="+0.00000e+00" law="ZeroOrder" coeff="1"/>
    <rxnData stoich="+0.00000e+00" law="FirstOrder" coeff="1"/>
    <rxnData stoich="+1" law="ZeroOrder" coeff="1"/>
  </particulate>
  <particulate name="Pseudomonas aeruginosa" abbr="Pse" rho="2.5e5">
    <rxnData stoich="1" law="FirstOrder" coeff="7.5"/>
    <rxnData stoich="+0.00000e+00" law="FirstOrder" coeff="1"/>
    <rxnData stoich="+0.00000e+00" law="ZeroOrder" coeff="1"/>
    <rxnData stoich="-1" law="FirstOrder" coeff="2"/>
  </particulate>
  <time init="+0.00000e+00" final="+1.00000e+01" step="1e-2"/>
  <numGrid>9</numGrid>
  <detach coeff1="15000" coeff2="0" coeff3="0" coeff4="0" coeff5="0"/>
  <flow time1="+0.00000e+00" flow1="+1.00000e00" time2="+9.99000e+02" flow2="+0.00000e00" time3="+9.99000e+02" flow3="+0.00000e00" time4="+9.99000e+02" flow4="+0.00000e00" time5="+9.99000e+02" flow5="+0.00000e00"/>
  <unit initThickness="5.0E-5" fixCalc="Calculate">
    <geometry area="1.0" thickness="1e-5" vol="0.1" voidFrac="0.92" diff="0.45" rate="0.0"/>
    <initSubstrate inletConc="53" bulkConc="+0.00000e+00" fixCalc="Calculate"/>
    <initSubstrate inletConc="0" bulkConc="+0.00000e+00" fixCalc="Calculate"/>
    <initParticulate inletConc="+0.00000e+01" bulkConc="+0.00000e+00" voidFrac="1e-8"/>
    <initParticulate inletConc="+0.00000e+01" bulkConc="+0.00000e+00" voidFrac="0.08"/>
  </unit>
  <numCoeff stol="0.00" ntol="0.00"/>
</BAM>
