<?xml version="1.0" encoding="UTF-8"?>
<!DOCTYPE BAM SYSTEM "bam.dtd">

<BAM>
  <modelName>McCarty HW6</modelName>
  <modelDescr>Demo case for BAM instruction</modelDescr>
  <rxnName>Growth</rxnName>
  <rxnName>Decay</rxnName>
  <substrate name="Methanol" abbr="Meth" diff="6.9e-5">
    <rxnData stoich="-2.646e0" law="Monod" coeff="1e0"/>
    <rxnData stoich="0" law="ZeroOrder" coeff="1e0"/>
  </substrate>
  <particulate name="Dead" abbr="Dead" rho="2.5e5">
    <rxnData stoich="0" law="ZeroOrder" coeff="1e0"/>
    <rxnData stoich="1e0" law="ZeroOrder" coeff="1e0"/>
  </particulate>
  <particulate name="Live" abbr="Live" rho="2.5e5">
    <rxnData stoich="1e0" law="FirstOrder" coeff="2"/>
    <rxnData stoich="-1e0" law="FirstOrder" coeff="1e-1"/>
  </particulate>
  <time init="+0.00000e+00" final="+1.00000e+01" step="+1.00000e-01"/>
  <numGrid>12</numGrid>
  <detach coeff1="20000" coeff2="0" coeff3="0" coeff4="0" coeff5="0"/>
  <flow time1="+0.00000e+00" flow1="+1.00000e00" time2="+9.99000e+02" flow2="+0.00000e00" time3="+9.99000e+02" flow3="+0.00000e00" time4="+9.99000e+02" flow4="+0.00000e00" time5="+9.99000e+02" flow5="+0.00000e00"/>
  <unit initThickness="1.0e-5" fixCalc="Calculate">
    <geometry area="1.0" thickness="1e7" vol="0.1" voidFrac="0.92" diff="0.5" rate="0.0"/>
    <initSubstrate inletConc="+1.00000e+02" bulkConc="+1.00000e+02" fixCalc="Calculate"/>
    <initParticulate inletConc="+0.00000e+01" bulkConc="+0.00000e+00" voidFrac="1.0e-8"/>
    <initParticulate inletConc="+0.00000e+01" bulkConc="+0.00000e+00" voidFrac="0.08"/>
  </unit>
  <numCoeff stol="0.00" ntol="0.00"/>
</BAM>
