<?xml version="1.0" encoding="UTF-8"?>
<!DOCTYPE BAM SYSTEM "bam.dtd">

<BAM>
  <modelName>BAM Demo</modelName>
  <modelDescr>Demo case for BAM instruction</modelDescr>
  <rxnName>Growth</rxnName>
  <rxnName>Decay</rxnName>
  <substrate name="Methanol" abbr="CH3OH" diff="+1.380000e-04">
    <rxnData stoich="-2.64600e+00" law="Monod" coeff="+1.0000e+00"/>
    <rxnData stoich="0" law="ZeroOrder" coeff="+1.0000e+00"/>
  </substrate>
  <substrate name="Biocide" abbr="bio" diff="+1.380000e-04">
    <rxnData stoich="-2.64600e+00" law="Monod" coeff="+1.0000e+00"/>
    <rxnData stoich="0" law="ZeroOrder" coeff="+1.0000e+00"/>
    <biocide conc="0" begin="0" duration="0" freq="999" det="0" pulseStep="Step"/>
  </substrate>
  <particulate name="Live" abbr="Live" rho="2.5e5">
    <rxnData stoich="+1.00000e+00" law="FirstOrder" coeff="+2.00000e+00"/>
    <rxnData stoich="-1.00000e+00" law="FirstOrder" coeff="+0.1000e+00"/>
  </particulate>
  <particulate name="Dead" abbr="Dead" rho="2.5e5">
    <rxnData stoich="+0.00000e+00" law="ZeroOrder" coeff="1"/>
    <rxnData stoich="+1.00000e+00" law="ZeroOrder" coeff="1"/>
  </particulate>
  <time init="+0.00000e+00" final="+1.00000e+02" step="+1.00000e-01"/>
  <numGrid>12</numGrid>
  <detach coeff1="1980" coeff2="0" coeff3="0" coeff4="0" coeff5="0"/>
  <flow time1="+0.00000e+00" flow1="+1.00000e00" time2="+9.99000e+02" flow2="+0.00000e00" time3="+9.99000e+02" flow3="+0.00000e00" time4="+9.99000e+02" flow4="+0.00000e00" time5="+9.99000e+02" flow5="+0.00000e00"/>
  <unit initThickness="5.0e-6" fixCalc="Calculate">
    <geometry area="1.0" thickness="1.0E-5" vol="0.1" voidFrac="0.92" diff="0.5" rate="0.0"/>
    <initSubstrate inletConc="+25" bulkConc="25" fixCalc="Calculate"/>
    <initSubstrate inletConc="+25" bulkConc="25" fixCalc="Calculate"/>
    <initParticulate inletConc="+0.00000e+01" bulkConc="+0.00000e+00" voidFrac="0.08"/>
    <initParticulate inletConc="+0.00000e+01" bulkConc="+0.00000e+00" voidFrac="1.0e-8"/>
  </unit>
  <numCoeff stol="0.00" ntol="0.00"/>
</BAM>
